{
  "kb_version": "1.0",
  "experiment_id": "bubble-sort",
  "lab_id": "data-structures-1-iiith",
  "title": "Bubble Sort",
  "origin": "https://ds1-iiith.vlabs.ac.in",
  "discipline": "Computer Science and Engineering",
  "institute": "IIITH",
  "reviewed_by": "VLAILA authoring team",
  "reviewed_on": "2026-08-03",
  "estimated_minutes": 60,
  "aim": "Given an unsorted array of numbers, generate a sorted array by applying Bubble Sort; optimise the algorithm for better performance; and reason about its time complexity by counting the operations in each iteration.",
  "learning_objectives": [
    "Trace bubble sort pass by pass and predict the array state after each pass.",
    "Explain why the largest unsorted element is guaranteed to be in place after each pass.",
    "Derive the O(n^2) comparison count and the best case O(n) for the optimised variant.",
    "Justify why bubble sort is a stable comparison sort."
  ],
  "tasks": [
    "Aim",
    "Basic Concept",
    "Algorithm",
    "Demo",
    "Practice",
    "Exercise",
    "Quiz",
    "Analysis",
    "Optimized Bubble Sort",
    "Code Assessment",
    "Feedback"
  ],

  "prerequisites": [
    {
      "id": "arrays",
      "title": "Array indexing and in-place swapping",
      "why": "Every operation in bubble sort is a compare-and-swap on adjacent indices; off-by-one confusion here makes the whole trace unreadable."
    },
    {
      "id": "big-o",
      "title": "Asymptotic notation",
      "why": "The Analysis unit asks for O(n^2) versus O(n); without Big-O the counting exercise has no destination."
    }
  ],

  "steps": [
    {
      "id": "read-concept",
      "order": 1,
      "task": "Basic Concept",
      "title": "Read the basic concept",
      "detect": { "action": "navigate", "task": "Basic Concept" },
      "expected_dwell_seconds": 60,
      "hints": {
        "nudge": "Start with the basic concept — it is short, and the demo makes much more sense after it.",
        "specific": "The core idea: repeatedly compare adjacent elements and swap them if they are out of order. After each full pass the largest remaining element has bubbled to its final position."
      },
      "concept_ref": "bubbling"
    },
    {
      "id": "read-algorithm",
      "order": 2,
      "task": "Algorithm",
      "title": "Read the algorithm and pseudocode",
      "requires": ["read-concept"],
      "detect": { "action": "navigate", "task": "Algorithm" },
      "expected_dwell_seconds": 60,
      "milestone": true,
      "hints": {
        "nudge": "Read the pseudocode before the demo so you can predict what it will do.",
        "specific": "Two nested loops: the outer counts passes, the inner walks adjacent pairs. Note that the inner loop can stop one element earlier each pass, because the tail is already sorted."
      },
      "concept_ref": "loop-invariant"
    },
    {
      "id": "watch-demo",
      "order": 3,
      "task": "Demo",
      "title": "Watch the animated demo",
      "requires": ["read-algorithm"],
      "detect": { "action": "click", "selector": "#next", "frame": "sim" },
      "stuck_after_seconds": 40,
      "hints": {
        "nudge": "Step through the demo — but predict each swap before you click Next.",
        "specific": "Use Next to advance one comparison at a time and Pause to stop the animation. The interval control changes the speed. Watching passively teaches far less than predicting each step first.",
        "interactive": {
          "highlight": "#next",
          "frame": "sim",
          "text": "Advance one comparison at a time."
        }
      },
      "concept": "Each pass guarantees exactly one more element is in its final position. That is the loop invariant, and it is why the algorithm terminates after at most n-1 passes."
    },
    {
      "id": "complete-demo-pass",
      "order": 4,
      "task": "Demo",
      "title": "Follow at least one complete pass",
      "requires": ["watch-demo"],
      "detect": { "action": "click", "selector": "#next", "frame": "sim", "count": 6 },
      "milestone": true,
      "hints": {
        "nudge": "Keep stepping until the end of a full pass — the payoff is at the boundary.",
        "specific": "At the end of a pass, note that the last element is now the maximum and never moves again. That single observation is the loop invariant made visible."
      },
      "concept_ref": "loop-invariant"
    },
    {
      "id": "practice-swap",
      "order": 5,
      "task": "Practice",
      "title": "Drive the sort yourself in Practice",
      "requires": ["complete-demo-pass"],
      "detect": { "action": "click", "selector": "#swap, #next", "frame": "sim" },
      "hints": {
        "nudge": "Now you decide: swap or move on?",
        "specific": "For each highlighted pair choose Swap if they are out of order, or Next if they are already correct. Practice gives feedback, so wrong choices are cheap here.",
        "interactive": {
          "highlight": "#swap",
          "frame": "sim",
          "text": "Swap this pair if they are out of order."
        }
      },
      "concept": "Bubble sort only ever compares adjacent elements. That restriction is exactly what makes it stable, and also what makes it slow."
    },
    {
      "id": "practice-complete",
      "order": 6,
      "task": "Practice",
      "title": "Complete a practice run",
      "requires": ["practice-swap"],
      "detect": { "action": "click", "selector": "#swap, #next", "frame": "sim", "count": 8 },
      "milestone": true,
      "hints": {
        "nudge": "Carry it through to a fully sorted array.",
        "specific": "Finish the run. Reset gives you a fresh array if you want a second attempt with different values."
      }
    },
    {
      "id": "start-exercise",
      "order": 7,
      "task": "Exercise",
      "title": "Start the graded exercise",
      "requires": ["practice-complete"],
      "detect": { "action": "click", "selector": "#start", "frame": "sim" },
      "hints": {
        "nudge": "Ready for the graded version? Practice first if you are unsure.",
        "specific": "The Exercise is the assessed variant of Practice. Undo is available, but the goal is to get each decision right the first time."
      }
    },
    {
      "id": "exercise-complete",
      "order": 8,
      "task": "Exercise",
      "title": "Complete the exercise",
      "requires": ["start-exercise"],
      "detect": { "action": "click", "selector": "#swap, #next", "frame": "sim", "count": 10 },
      "milestone": true,
      "hints": {
        "nudge": "Work through each comparison in turn.",
        "specific": "At each highlighted pair decide swap or skip. If you get stuck, Undo steps back one decision rather than restarting the whole run."
      }
    },
    {
      "id": "read-analysis",
      "order": 9,
      "task": "Analysis",
      "title": "Work through the complexity analysis",
      "requires": ["exercise-complete"],
      "detect": { "action": "navigate", "task": "Analysis" },
      "expected_dwell_seconds": 90,
      "milestone": true,
      "hints": {
        "nudge": "Now count the operations you just performed — that is where the O(n^2) comes from.",
        "specific": "Pass 1 does n-1 comparisons, pass 2 does n-2, and so on. Summing gives n(n-1)/2, hence O(n^2). The Analysis unit also covers space complexity and stability."
      },
      "concept_ref": "complexity"
    },
    {
      "id": "optimized-variant",
      "order": 10,
      "task": "Optimized Bubble Sort",
      "title": "Study the optimised variant",
      "requires": ["read-analysis"],
      "detect": { "action": "navigate", "task": "Optimized Bubble Sort" },
      "milestone": true,
      "hints": {
        "nudge": "One flag turns the best case from O(n^2) into O(n) — see how.",
        "specific": "Track whether any swap occurred during a pass. If a full pass completes with no swaps the array is already sorted and you can stop, giving O(n) on already-sorted input.",
        "interactive": {
          "highlight": "a[href*='optimized']",
          "frame": "host",
          "text": "The optimised variant."
        }
      },
      "concept": "The early-exit flag changes only the best case. Worst and average cases stay O(n^2), because a single element far from its position still forces a full set of passes.",
      "concept_ref": "optimisation"
    }
  ],

  "errors": [
    {
      "id": "demo-before-algorithm",
      "severity": "recoverable",
      "when": {
        "action": "navigate",
        "on_task": "Demo",
        "unless_completed": ["read-algorithm"]
      },
      "message": "You jumped to the demo before the algorithm. Watching the animation without the pseudocode tends to leave you recognising the pattern rather than able to reproduce it.",
      "correction_step": "read-algorithm",
      "confidence": 0.8
    },
    {
      "id": "exercise-before-practice",
      "severity": "recoverable",
      "when": {
        "action": "navigate",
        "on_task": "Exercise",
        "unless_completed": ["practice-complete"]
      },
      "message": "The Exercise is assessed and Practice is not. Practice gives you the same decisions with immediate feedback and no cost — worth doing first.",
      "correction_step": "practice-swap",
      "confidence": 0.85
    },
    {
      "id": "demo-clicking-through",
      "severity": "recoverable",
      "when": {
        "action": "click",
        "selector": "#next",
        "frame": "sim",
        "repeat_count": 12
      },
      "message": "You are advancing quickly. Try pausing before each Next and predicting whether this pair will swap — the prediction is where the learning happens.",
      "correction_step": "watch-demo",
      "confidence": 0.7
    },
    {
      "id": "reset-thrashing",
      "severity": "recoverable",
      "when": {
        "action": "click",
        "selector": "#reset",
        "frame": "sim",
        "repeat_count": 3
      },